{
  "specversion": "1.0",
  "id": "0199a1c4-2b6e-7d10-9a3f-5c8e1d2f4a02",
  "type": "straza.audit.mcp",
  "source": "strazad",
  "time": "2026-10-01T09:20:11.418Z",
  "data": {
    "session": "0197fa3d-1111-7abc-9def-000000000001",
    "user": "joe-java-developer-agent",
    "harness": "claude-code/2.1.0",
    "event": "resources.read",
    "tool": "",
    "app": "dashboards",
    "toolName": "",
    "effect": "allow",
    "ruleId": "",
    "setName": "",
    "reason": "view served",
    "snapshot": "sha256:44f0be1c",
    "granted": false,
    "default": false,
    "uri": "ui://dashboards/panel"
  }
}
