{
  "specversion": "1.0",
  "id": "0199e2b0-1a01-7c40-8d11-2a3b4c5d6e05",
  "type": "straza.audit.admin",
  "source": "strazad/7f3c2a11-4b5d-4c6e-8f90-a1b2c3d4e5f6",
  "time": "2026-09-29T08:07:45.264Z",
  "data": {
    "action": "nhi-key.set",
    "actor": "alice",
    "actorId": "0197fa3d-1111-7abc-9def-000000000001",
    "actorVia": "session",
    "target": "0199e2b0-1a01-7c40-8d11-2a3b4c5d6e10",
    "user": "0199e2b0-1a01-7c40-8d11-2a3b4c5d6e10",
    "username": "release-bot",
    "fingerprint": "sha256:f8e5b5d1c98c98f49f6e317678034d98f66208263dbf3d769cba31b56e7c882e"
  }
}
