{
  "specversion": "1.0",
  "id": "0197fa3e-c0de-7c22-a9d4-1b2c3d4e5f99",
  "type": "straza.identity.updated",
  "source": "strazad",
  "time": "2026-09-21T18:30:00Z",
  "data": {
    "action": "oauth.connect.refused",
    "user": "0197fa3d-4444-7abc-9def-000000000004",
    "setBy": "0197fa3d-3333-7abc-9def-000000000003",
    "app": "github",
    "provider": "github",
    "reason": "the state names another user"
  }
}
