{
  "specversion": "1.0",
  "id": "01a0b8d2-5e11-7a20-9b31-2c3d4e5f6071",
  "type": "straza.audit.admin",
  "source": "strazad/7f3c2a11-4b5d-4c6e-8f90-a1b2c3d4e5f6",
  "time": "2026-09-24T10:14:03.512Z",
  "data": {
    "action": "draft.create",
    "actor": "ci-bundles",
    "actorId": "01a0b8d0-7c21-7a10-8b41-3c4d5e6f7081",
    "actorVia": "api-token",
    "draft": "41",
    "revision": 1,
    "door": "api",
    "items": [
      {"kind": "App", "name": "github", "op": "put"},
      {"kind": "Role", "name": "github-readers", "op": "put"},
      {"kind": "Role", "name": "github-writers", "op": "put"},
      {"kind": "PolicySet", "name": "github-writers-access", "op": "put"}
    ],
    "digest": "8130b15ede6ca4ba384508f6cb967d7591a3375c7b14d0d12432fc662c0723fb"
  }
}
