{
  "specversion": "1.0",
  "id": "0199d3a4-6b21-7e55-9abc-1f2e3d4c5b42",
  "type": "straza.audit.authn",
  "source": "strazad/7f3c2a11-4b5d-4c6e-8f90-a1b2c3d4e5f6",
  "time": "2026-09-29T09:14:52.118Z",
  "data": {
    "action": "login",
    "outcome": "failure",
    "via": "approver-token",
    "user": "judy",
    "userId": "0197fa3d-2222-7abc-9def-000000000002",
    "approvalId": "0199d3a1-0c77-7e55-9abc-1f2e3d4c5b40",
    "reason": "only a person can decide a request",
    "sourceIp": "203.0.113.7"
  }
}
