{
  "specversion": "1.0",
  "id": "019a0e2c-4d2e-7f10-8a3b-5c6d7e8f9a35",
  "type": "straza.audit.mcp",
  "source": "strazad",
  "time": "2026-09-21T11:04:12.118Z",
  "data": {
    "session": "019a0e2b-1111-7abc-9def-000000000001",
    "user": "019a0e2a-2222-7abc-9def-00000000joe0",
    "harness": "claude-code/2.1.0",
    "event": "tool.pre",
    "tool": "mcp.call",
    "app": "midpoint",
    "toolName": "whoami",
    "arguments": "{}",
    "effect": "allow",
    "ruleId": "",
    "setName": "",
    "reason": "allowed by role access. No policy rule gates this tool.",
    "snapshot": "sha256:44f0be1c",
    "granted": true,
    "default": true,
    "bindingId": "019a0e2a-3333-7abc-9def-000000000002",
    "role": "dev",
    "credentialId": "client_credentials:019a0e2a-4444-7abc-9def-0000midpoint:019a0e2a-2222-7abc-9def-00000000joe0",
    "credentialSource": "client_credentials"
  }
}
