{
  "specversion": "1.0",
  "id": "0199e2b0-1a01-7c40-8d11-2a3b4c5d6e04",
  "type": "straza.audit.admin",
  "source": "strazad/7f3c2a11-4b5d-4c6e-8f90-a1b2c3d4e5f6",
  "time": "2026-09-29T08:06:19.930Z",
  "data": {
    "action": "approver.enroll",
    "actor": "judy",
    "actorId": "0197fa3d-2222-7abc-9def-000000000002",
    "actorVia": "enroll-token",
    "target": "apd_0199e2b0-1a01-7c40-8d11-2a3b4c5d6e20",
    "user": "0197fa3d-2222-7abc-9def-000000000002",
    "username": "judy",
    "device": "apd_0199e2b0-1a01-7c40-8d11-2a3b4c5d6e20",
    "platform": "browser",
    "name": "Edge on work laptop"
  }
}
