{
  "specversion": "1.0",
  "id": "5a1e9d2c-7b34-4f10-9c8e-2d6f0a1b3c4d",
  "type": "straza.audit.reply",
  "source": "straza",
  "time": "2026-07-26T14:12:09.421Z",
  "data": {
    "session": "ses_01j9x2k7m4",
    "user": "u_alice",
    "harness": "claude-code/2.1",
    "content": "Scanned the three services; only payments-api pins the vulnerable version.",
    "mode": "verbatim",
    "truncated": false,
    "contentHash": "sha256:9f2b7c1d0e8a6453b2a1908c7d6e5f4a3b2c1d0e9f8a7b6c5d4e3f2a1b0c9d8e",
    "agentType": "researcher",
    "agentId": "agent-3f9c2a"
  }
}
