{
  "specversion": "1.0",
  "id": "0197fa3e-bb02-7c22-a9d4-1b2c3d4e5f99",
  "type": "straza.audit.prompt",
  "source": "straza",
  "time": "2026-07-15T15:41:07Z",
  "data": {
    "session": "0197fa3d-4444-7abc-9def-000000000007",
    "user": "0197fa3d-3333-7abc-9def-000000000003",
    "harness": "claude-code/2.1.0",
    "content": "deploy the staging branch and tail the logs",
    "mode": "verbatim",
    "truncated": false,
    "contentHash": "sha256:8f434346648f6b96df89dda901c5176b10a6d83961dd3c1ac88b59b2dc327aa4"
  }
}
