{
  "specversion": "1.0",
  "id": "0199e2b0-1a01-7c40-8d11-2a3b4c5d6e03",
  "type": "straza.audit.admin",
  "source": "strazad/7f3c2a11-4b5d-4c6e-8f90-a1b2c3d4e5f6",
  "time": "2026-09-29T08:05:02.551Z",
  "data": {
    "action": "enroll-token.create",
    "actor": "judy",
    "actorId": "0197fa3d-2222-7abc-9def-000000000002",
    "actorVia": "login",
    "target": "0197fa3d-2222-7abc-9def-000000000002",
    "user": "0197fa3d-2222-7abc-9def-000000000002",
    "username": "judy",
    "channel": "browser",
    "self": true
  }
}
